{
  "run_id": "20260902-1519-b2b-corporativo",
  "task_title": "B2B — Produto Corporativo",
  "status": "closed",
  "current_phase": "done",
  "iteration_count": 0,
  "max_iterations": 3,
  "requested_by": "usuário (buttielle3@gmail.com)",
  "source_spec": "agentic-framework/specs/b2b-corporativo.md",
  "phases": {
    "planning": { "status": "done", "agent": "orchestrator", "started_at": "2026-09-02T15:19:00-03:00", "finished_at": "2026-09-02T15:22:00-03:00", "notes": "" },
    "implementation": { "status": "done", "agent": "orchestrator (agindo como executor)", "execution_mode": "self_executed_fallback", "started_at": "2026-09-02T15:22:00-03:00", "finished_at": "2026-09-02T15:22:00-03:00", "notes": "6/6 critérios implementados. Bug real de bootstrap de organização encontrado e corrigido durante escrita de testes." },
    "testing": { "status": "done", "agent": "orchestrator (via run-20260903-1350-validacao-real-suite-completa e run-20260903-1600-validacao-navegador)", "execution_mode": "delegated", "started_at": "2026-09-03T13:50:00-03:00", "finished_at": "2026-09-03T16:00:00-03:00", "notes": "pytest completo (190 passed). Rota /empresa confirmada por clique real no navegador (bug de formulário exposto sem organização encontrado e corrigido nessa passada)." },
    "review": { "status": "done", "agent": "reviewer (revisão de segurança dedicada, 2026-09-04)", "execution_mode": "delegated", "started_at": "2026-09-04T00:00:00-03:00", "finished_at": "2026-09-04T00:00:00-03:00", "notes": "Veredito: approve, sem findings. Confirmado: organizacao_do_usuario é o único ponto de derivação de organização a partir do usuário autenticado; nenhuma view aceita organizacao_id vindo da URL/payload; _exigir_admin_da_organizacao checado antes de adicionar/remover membro. Isolamento entre organizações (BRD §19-20) considerado sólido." },
    "remediation": { "status": "skipped", "agent": "orchestrator", "started_at": null, "finished_at": null, "notes": "Nenhum finding a remediar." },
    "documentation": { "status": "done", "agent": "documenter", "execution_mode": "delegated", "started_at": "2026-09-03T00:00:00-03:00", "finished_at": "2026-09-03T00:00:00-03:00", "notes": "Endpoints de b2b documentados em README.md." },
    "closing": { "status": "done", "agent": "orchestrator (reconciliação retroativa)", "started_at": "2026-09-04T00:00:00-03:00", "finished_at": "2026-09-04T00:00:00-03:00", "notes": "Fechamento tardio após revisão de segurança dedicada (gatilho obrigatório de review-triggers.md — afeta contratos com clientes corporativos, BRD §19-20)." }
  },
  "findings": { "blocker": 0, "major": 0, "minor": 0, "nit": 0, "resolved": 1 },
  "artifacts": {
    "task_plan": "task-plan.md",
    "implementation_history": "implementation-history.md",
    "report": "report.md"
  },
  "blocked_reason": null,
  "follow_ups": [
    "Plan (assinatura/) não distingue B2C de B2B estruturalmente — só por nome do plano (simplificação registrada no task-plan.md).",
    "Múltiplas organizações por usuário está fora de escopo (1:1 nesta execução)."
  ],
  "created_at": "2026-09-02T15:19:00-03:00",
  "updated_at": "2026-09-04T00:00:00-03:00"
}
