{
  "run_id": "20260902-1620-frontend-b2b-metricas",
  "task_title": "Frontend de B2B e Painel de Métricas (última lacuna de frontend do MVP+Premium)",
  "status": "blocked",
  "current_phase": "implementation",
  "iteration_count": 0,
  "max_iterations": 3,
  "requested_by": "usuário (buttielle3@gmail.com)",
  "source_spec": "agentic-framework/specs/b2b-corporativo.md, agentic-framework/specs/painel-metricas-negocio.md",
  "phases": {
    "planning": { "status": "done", "agent": "orchestrator", "started_at": "2026-09-02T16:20:00-03:00", "finished_at": "2026-09-02T16:23:00-03:00", "notes": "" },
    "implementation": { "status": "blocked", "agent": "orchestrator (agindo como executor)", "started_at": "2026-09-02T16:23:00-03:00", "finished_at": null, "notes": "5/5 critérios implementados. Lacuna de backend (endpoint de membros do b2b) encontrada e corrigida." },
    "testing": { "status": "pending", "agent": "tester", "started_at": null, "finished_at": null, "notes": "" },
    "review": { "status": "pending", "agent": "reviewer", "started_at": null, "finished_at": null, "notes": "" },
    "remediation": { "status": "pending", "agent": "remediator", "started_at": null, "finished_at": null, "notes": "" },
    "documentation": { "status": "pending", "agent": "documenter", "started_at": null, "finished_at": null, "notes": "" },
    "closing": { "status": "pending", "agent": "historian", "started_at": null, "finished_at": null, "notes": "" }
  },
  "findings": { "blocker": 0, "major": 0, "minor": 0, "nit": 0, "resolved": 1 },
  "artifacts": {
    "task_plan": "task-plan.md",
    "implementation_history": "implementation-history.md"
  },
  "blocked_reason": "Implementação completa (5/5 critérios, incluindo correção de lacuna de backend), validação por execução pendente (mesma limitação de sessão: Bash/Agent/Browser bloqueados pelo classificador de segurança).",
  "follow_ups": [
    "Rodar manage.py check / makemigrations --check / migrate / pytest (backend) e npm install && npm run build (frontend) assim que possível — PRIORIDADE MÁXIMA, nada neste projeto foi executado de fato desde o início da falha do classificador.",
    "Com este run, todos os 13 módulos do BRD têm frontend — próximo passo natural é validação end-to-end real, não mais construção de features novas."
  ],
  "created_at": "2026-09-02T16:20:00-03:00",
  "updated_at": "2026-09-02T16:23:00-03:00"
}
