{
  "run_id": "20260902-1448-frontend-mvp-web",
  "task_title": "Frontend Web do MVP (identidade, feed, assinatura)",
  "status": "blocked",
  "current_phase": "implementation",
  "iteration_count": 0,
  "max_iterations": 3,
  "requested_by": "usuário (buttielle3@gmail.com)",
  "source_spec": "agentic-framework/specs/cadastro-autenticacao-onboarding.md, agentic-framework/specs/feed-consumo-noticias.md, agentic-framework/specs/assinatura-premium.md",
  "phases": {
    "planning": { "status": "done", "agent": "orchestrator", "started_at": "2026-09-02T14:48:00-03:00", "finished_at": "2026-09-02T15:00:00-03:00", "notes": "" },
    "implementation": { "status": "blocked", "agent": "orchestrator (agindo como executor — Agent/Bash/preview indisponíveis)", "started_at": "2026-09-02T15:00:00-03:00", "finished_at": null, "notes": "10/10 critérios implementados. Descoberto e corrigido bug real: CORS não configurado no backend (django-cors-headers adicionado). MAIOR risco de validação da sessão — nenhum comando de build/execução de frontend pôde rodar (npm install/next build/next dev), inclusive a preview do navegador foi testada e recusada pelo mesmo classificador." },
    "testing": { "status": "pending", "agent": "tester", "started_at": null, "finished_at": null, "notes": "" },
    "review": { "status": "pending", "agent": "reviewer", "started_at": null, "finished_at": null, "notes": "" },
    "remediation": { "status": "pending", "agent": "remediator", "started_at": null, "finished_at": null, "notes": "" },
    "documentation": { "status": "pending", "agent": "documenter", "started_at": null, "finished_at": null, "notes": "" },
    "closing": { "status": "pending", "agent": "historian", "started_at": null, "finished_at": null, "notes": "" }
  },
  "findings": { "blocker": 0, "major": 0, "minor": 0, "nit": 0, "resolved": 0 },
  "artifacts": {
    "task_plan": "task-plan.md",
    "implementation_contract": "implementation-contract.md",
    "implementation_history": "implementation-history.md"
  },
  "blocked_reason": "Implementação completa (10/10 critérios), mas SEM NENHUMA validação por execução — nem npm install/next build/next dev, nem a preview do navegador (testada e recusada pelo mesmo classificador indisponível). Este é o maior risco de toda a sessão: erros de sintaxe/tipo TypeScript/JSX só aparecem em build, diferente de Python onde a maior parte do risco é lógica de negócio.",
  "follow_ups": [
    "MÁXIMA PRIORIDADE: rodar `npm install && npm run build` em frontend/ assim que possível — é o único jeito de saber se o código realmente compila.",
    "Rodar `pip install -r requirements.txt` no backend (django-cors-headers foi adicionado) e reiniciar o servidor antes de testar a integração.",
    "Testar manualmente o fluxo completo no navegador (cadastro → verificar e-mail → login → onboarding → feed → assinar → cancelar) assim que o build funcionar.",
    "Login social (Google) não tem UI — não-objetivo explícito desta execução.",
    "Nenhum teste automatizado de frontend foi escrito (Jest/Playwright) — não-objetivo explícito, dado que nem o build pôde ser validado nesta sessão."
  ],
  "created_at": "2026-09-02T14:48:00-03:00",
  "updated_at": "2026-09-02T15:00:00-03:00"
}
