{
  "run_id": "20260902-1506-comunidade-blog",
  "task_title": "Comunidade e Blog",
  "status": "blocked",
  "current_phase": "implementation",
  "iteration_count": 0,
  "max_iterations": 3,
  "requested_by": "usuário (buttielle3@gmail.com)",
  "source_spec": "agentic-framework/specs/comunidade-blog.md",
  "phases": {
    "planning": { "status": "done", "agent": "orchestrator", "started_at": "2026-09-02T15:06:00-03:00", "finished_at": "2026-09-02T15:10:00-03:00", "notes": "" },
    "implementation": { "status": "blocked", "agent": "orchestrator (agindo como executor)", "started_at": "2026-09-02T15:10:00-03:00", "finished_at": null, "notes": "7/7 critérios implementados. Endpoint denunciar/ depende do próximo módulo (moderacao) para funcionar de fato." },
    "testing": { "status": "pending", "agent": "tester", "started_at": null, "finished_at": null, "notes": "" },
    "review": { "status": "pending", "agent": "reviewer", "started_at": null, "finished_at": null, "notes": "" },
    "remediation": { "status": "pending", "agent": "remediator", "started_at": null, "finished_at": null, "notes": "" },
    "documentation": { "status": "pending", "agent": "documenter", "started_at": null, "finished_at": null, "notes": "" },
    "closing": { "status": "pending", "agent": "historian", "started_at": null, "finished_at": null, "notes": "" }
  },
  "findings": { "blocker": 0, "major": 0, "minor": 0, "nit": 0, "resolved": 0 },
  "artifacts": {
    "task_plan": "task-plan.md",
    "implementation_contract": "implementation-contract.md",
    "implementation_history": "implementation-history.md"
  },
  "blocked_reason": "Implementação completa (7/7 critérios), validação por execução pendente (mesma limitação de sessão). Endpoint denunciar/ só funciona de fato após o módulo moderacao-reputacao-governanca (próximo desta leva).",
  "follow_ups": [
    "Rodar suíte de testes assim que possível.",
    "Fluxo de aprovação editorial humana antes de publicar (além do credenciamento) é uma extensão futura possível, não implementada aqui — confirmar se é necessária."
  ],
  "created_at": "2026-09-02T15:06:00-03:00",
  "updated_at": "2026-09-02T15:10:00-03:00"
}
