{"artifacts": {"implementation_contract": "implementation-contract.md", "task_plan": "task-plan.md"}, "created_at": "2026-09-09T12:00:00Z",   "current_phase": "closing", "follow_ups": [], "iteration_count": 0, "max_iterations": 3, "phases": {"closing": {"agent": "historian", "execution_mode": "delegated", "status": "in_progress"}, "documentation": {"agent": "documenter", "execution_mode": "delegated", "status": "pending"}, "implementation": {"agent": "executor", "execution_mode": "delegated", "status": "pending"}, "planning": {"agent": "orchestrator", "execution_mode": "delegated", "status": "in_progress"}, "review": {"agent": "reviewer", "execution_mode": "delegated", "status": "pending"}, "testing": {"agent": "tester", "execution_mode": "delegated", "status": "pending"}}, "requested_by": "usuario (portal de noticias - rebuild frontend)", "run_id": "20260909-1200-frontend-rebuild", "source_spec": null,   "status": "in_progress", "task_title": "Rebuild total do frontend - layout moderno e responsivo", "updated_at": "2026-09-09T18:00:00Z"}