{
  "run_id": "20260925-1836-usuarios-teste-dev-homolog",
  "task_title": "Usuários de teste (um por perfil) criados no deploy de DEV e HOMOLOG",
  "status": "in_progress",
  "current_phase": "planning",
  "iteration_count": 2,
  "max_iterations": 3,
  "requested_by": "humano (sessão de chat)",
  "source_spec": null,
  "phases": {
    "planning": {
      "status": "in_progress",
      "agent": "orchestrator",
      "execution_mode": "delegated",
      "started_at": "2026-09-25T18:36:12-03:00",
      "finished_at": "2026-09-25T18:52:00-03:00",
      "notes": "Pedido avaliado e 3 decisões confirmadas com o solicitante: (1) sem senha fixa no repo — fluxo de recuperação de senha, com troca de senha solicitada no primeiro login; (2) um usuário por perfil (free/premium/admin); (3) feature -> develop -> PR para main. Fluxo verificado no código antes de fechar o contrato: RedefinirSenhaView grava só 'password' (flag deve_trocar_senha sobrevive), login/page.tsx:18 redireciona para /trocar-senha, e as telas /recuperar-senha e /redefinir-senha já existem."
    },
    "implementation": {
      "status": "done",
      "agent": "executor",
      "execution_mode": "delegated",
      "started_at": "2026-09-25T18:41:00-03:00",
      "finished_at": "2026-09-25T19:05:00-03:00",
      "notes": "Flag --sem-senha no criar_usuario_carga (idempotente: só reescreve senha quando a conta ainda nao tem senha utilizavel); 17 testes em backend/identidade/tests/test_usuarios_teste.py; input usuarios_teste (default false) + funcao provisionar_usuarios_teste no deploy.yml; dev/homolog true, prod false explicito, rollback nao declara. Reportou 76 passed em identidade/ e 834 passed na suite completa. Nao tocou em subir-localhost, models, serializers, views, migrations nem frontend."
    },
    "testing": {
      "status": "done",
      "agent": "tester",
      "execution_mode": "delegated",
      "started_at": "2026-09-25T19:06:00-03:00",
      "finished_at": "2026-09-25T19:48:00-03:00",
      "notes": "passed 12/12. Reproduziu o gate do CI de verdade (Postgres 16): 841 passed, cobertura 91.15%, criar_usuario_carga.py 97%. ACHADO: buraco real na suite do executor - a mutacao 'deve_trocar_senha=False no ramo que preserva a senha' passa os 17 testes do executor (o proprio test_redeploy ja espera False) e so morre nos 7 testes que ele mesmo adicionou em test_usuarios_teste_complemento_tester.py. VERIFICADO INDEPENDENTEMENTE pelo orchestrator: mutacao exata -> 17 passed no executor, 2 failed no complemento. Critério 4 provado por diff contra git HEAD em 9 cenários legados (diff vazio, inclui o caminho do getpass e do subir-localhost.sh). Critérios 5/6/9/10/11 por execucao do bloco literal do YAML extraido com yaml.safe_load, com argv/env gravados. RESSALVA (FLY-1): test_command_agendar_ingestao.py::test_sigterm... e flaky de outra run (arquivo untracked da run 20260925-2136); o criterio 12 so fica verde por margem hoje."
    },
    "review": {
      "status": "done",
      "agent": "reviewer",
      "execution_mode": "delegated",
      "started_at": "2026-09-25T19:06:00-03:00",
      "finished_at": "2026-09-25T19:52:00-03:00",
      "notes": "changes_requested: 0 blocker / 1 major / 1 minor / 2 nit. MAJOR (security, deploy.yml:262/294-297/618/640): o valor que o gate USA nao e o valor que o gate VALIDA - 'set -a; . ./.env' (linha 618) roda DEPOIS do case (294) e ANTES do gate ler USUARIOS_TESTE (640), entao uma linha USUARIOS_TESTE=true no .env da VPS (chmod 600, nunca sobrescrito) sobrepoe o input e LIGA o gate em PROD, sem diff nem aviso. VERIFICADO INDEPENDENTEMENTE pelo orchestrator: reproduzido em dash, 'RESULTADO: gate RODOU'. MINOR (deploy.yml:667 + settings.py:476): o unico caminho de entrada depende de backend de e-mail real, que nada configura (bootstrap do .env nao traz DJANGO_EMAIL_BACKEND) - o e-mail nao chega e o uid/token fica no log do PM2. Confirmados ambos por leitura independente. O reviewer tambem CONFIRMOU como corretos: ausencia de vazamento de senha, retrocompatibilidade do --password default=None, idempotencia sem estado que tranque ninguem, criterio 9 e o $extra sem aspas, PROD/rollback fail-closed por omissao, e os testes."
    },
    "remediation": { "status": "in_progress", "agent": "remediator", "execution_mode": "delegated", "started_at": "2026-09-25T19:55:00-03:00", "finished_at": null, "notes": "Iteracao 1. Fechando o major (fronteira de PROD) e o minor (caminho de entrada)." },
    "documentation": { "status": "pending", "agent": "documenter", "execution_mode": "delegated", "started_at": null, "finished_at": null, "notes": "" },
    "closing": { "status": "pending", "agent": "historian", "execution_mode": "delegated", "started_at": null, "finished_at": null, "notes": "" }
  },
  "findings": { "blocker": 0, "major": 0, "minor": 0, "nit": 0, "resolved": 0 },
  "artifacts": {
    "task_plan": "task-plan.md",
    "implementation_contract": "implementation-contract.md"
  },
  "blocked_reason": null,
  "follow_ups": [],
  "created_at": "2026-09-25T18:36:12-03:00",
  "updated_at": "2026-09-25T18:36:12-03:00"
}
