{
  "run_id": "20260902-1534-frontend-comunidade-credenciamento",
  "task_title": "Frontend de Credenciamento e Comunidade",
  "status": "closed",
  "current_phase": "done",
  "iteration_count": 0,
  "max_iterations": 3,
  "requested_by": "usuário (buttielle3@gmail.com)",
  "source_spec": "agentic-framework/specs/credenciamento-jornalistas.md, agentic-framework/specs/comunidade-blog.md",
  "phases": {
    "planning": { "status": "done", "agent": "orchestrator", "started_at": "2026-09-02T15:34:00-03:00", "finished_at": "2026-09-02T15:36:00-03:00", "notes": "" },
    "implementation": { "status": "done", "agent": "orchestrator (agindo como executor)", "execution_mode": "self_executed_fallback", "started_at": "2026-09-02T15:36:00-03:00", "finished_at": "2026-09-02T15:36:00-03:00", "notes": "6/6 critérios implementados. Corrigida lacuna de backend (endpoint de detalhe de publicação) encontrada ao construir a tela." },
    "testing": { "status": "done", "agent": "orchestrator (via run-20260903-1350-validacao-real-suite-completa)", "execution_mode": "delegated", "started_at": "2026-09-03T13:50:00-03:00", "finished_at": "2026-09-03T15:20:00-03:00", "notes": "`npx tsc --noEmit` e `npm run build` limpos (25 rotas), cobrindo estas páginas. NÃO confirmado por clique real no navegador nesta reconciliação — a run de validação de navegador cobriu radar/lista-de-espera/admin-métricas/empresa/minha-conta, não especificamente /comunidade ou /jornalista/*. Ver follow-up." },
    "review": { "status": "skipped", "agent": "orchestrator", "started_at": null, "finished_at": null, "notes": "A lógica de negócio sensível (quem pode publicar sem moderação, reputação) vive no backend de credenciamento/comunidade/moderacao, revisada separadamente. Esta run é só a camada de frontend consumindo APIs já existentes." },
    "remediation": { "status": "skipped", "agent": "orchestrator", "started_at": null, "finished_at": null, "notes": "Nenhum finding a remediar." },
    "documentation": { "status": "done", "agent": "documenter", "execution_mode": "delegated", "started_at": "2026-09-03T00:00:00-03:00", "finished_at": "2026-09-03T00:00:00-03:00", "notes": "Rotas /jornalista/solicitar, /jornalista/status, /comunidade, /comunidade/nova, /comunidade/[id], /autor/[id] documentadas em README.md." },
    "closing": { "status": "done", "agent": "orchestrator (reconciliação retroativa)", "started_at": "2026-09-03T00:00:00-03:00", "finished_at": "2026-09-03T00:00:00-03:00", "notes": "Fechamento tardio, reconciliado nesta passada." }
  },
  "findings": { "blocker": 0, "major": 0, "minor": 0, "nit": 0, "resolved": 0 },
  "artifacts": {
    "task_plan": "task-plan.md",
    "implementation_history": "implementation-history.md",
    "report": "report.md"
  },
  "blocked_reason": null,
  "follow_ups": [
    "Clique real no navegador em /jornalista/solicitar, /jornalista/status, /comunidade e /autor/[id] ainda não foi feito — só compilação/tipo foram validados. Baixo risco (páginas de consumo de API já testada), mas recomendado antes de anunciar a feature."
  ],
  "created_at": "2026-09-02T15:34:00-03:00",
  "updated_at": "2026-09-04T00:00:00-03:00"
}
