{
  "run_id": "20260902-1517-landing-lista-espera",
  "task_title": "Landing Page e Lista de Espera",
  "status": "blocked",
  "current_phase": "implementation",
  "iteration_count": 0,
  "max_iterations": 3,
  "requested_by": "usuário (buttielle3@gmail.com)",
  "source_spec": "agentic-framework/specs/landing-lista-espera.md",
  "phases": {
    "planning": { "status": "done", "agent": "orchestrator", "started_at": "2026-09-02T15:17:00-03:00", "finished_at": "2026-09-02T15:18:00-03:00", "notes": "" },
    "implementation": { "status": "blocked", "agent": "orchestrator (agindo como executor)", "started_at": "2026-09-02T15:18:00-03:00", "finished_at": null, "notes": "4/5 critérios (backend completo). Frontend da página adiado — follow-up." },
    "testing": { "status": "pending", "agent": "tester", "started_at": null, "finished_at": null, "notes": "" },
    "review": { "status": "pending", "agent": "reviewer", "started_at": null, "finished_at": null, "notes": "" },
    "remediation": { "status": "pending", "agent": "remediator", "started_at": null, "finished_at": null, "notes": "" },
    "documentation": { "status": "pending", "agent": "documenter", "started_at": null, "finished_at": null, "notes": "" },
    "closing": { "status": "pending", "agent": "historian", "started_at": null, "finished_at": null, "notes": "" }
  },
  "findings": { "blocker": 0, "major": 0, "minor": 0, "nit": 0, "resolved": 0 },
  "artifacts": {
    "task_plan": "task-plan.md",
    "implementation_history": "implementation-history.md"
  },
  "blocked_reason": "Backend completo, validação por execução pendente (mesma limitação de sessão).",
  "follow_ups": [
    "Página frontend de landing/lista de espera (critério de aceite 5) não construída — priorizado fechar backend de todos os módulos do BRD primeiro.",
    "Rodar suíte de testes assim que possível."
  ],
  "created_at": "2026-09-02T15:17:00-03:00",
  "updated_at": "2026-09-02T15:18:00-03:00"
}
