{
  "run_id": "20260903-1134-seo-lgpd-design-system",
  "task_title": "Base transversal: SEO técnico/schema.org, LGPD/cookies, rate limiting e design system",
  "status": "in_progress",
  "current_phase": "implementation",
  "iteration_count": 2,
  "max_iterations": 3,
  "requested_by": "usuário (chat)",
  "source_spec": null,
  "phases": {
    "planning": {
      "status": "done",
      "agent": "orchestrator",
      "started_at": "2026-09-03T11:34:00-03:00",
      "finished_at": "2026-09-03T11:34:00-03:00",
      "notes": "task-plan.md e implementation-contract.md criados. Run 1 de N de uma iniciativa maior (backlog completo de UX/produto)."
    },
    "implementation": {
      "status": "done",
      "agent": "executor",
      "started_at": "2026-09-03T11:34:00-03:00",
      "finished_at": "2026-09-03T12:05:00-03:00",
      "notes": "Escopo A-D implementado. Lacuna de backend corrigida: identidade ganhou services.py (não existia) + endpoint de preferências de cookies. Validação real: tsc --noEmit limpo, manage.py check/makemigrations limpos, pytest identidade/comunidade/landing 57 passed, next build de produção 25 rotas, verificação funcional real de sitemap/robots/rss/JSON-LD via next start + backend. Execução concorrente com outra sessão editando settings.py/comunidade/views.py/Rodape.tsx no mesmo repo — mudanças preservadas via Edit, revalidado depois."
    },
    "testing": { "status": "done", "agent": "tester", "started_at": "2026-09-03T12:05:00-03:00", "finished_at": "2026-09-03T16:20:00-03:00", "notes": "Veredito original: failed no critério 7 (valores hardcoded fora dos tokens em globals.css). Critérios 3,4,5,6 e suíte backend completa (221 passed, throttle real ativo via DJANGO_CACHE_BACKEND=locmem) passaram de primeira. Critério 7 corrigido pelo remediator (Iteração 3) e revalidado via tsc --noEmit + next build isolado (25 rotas, sem erro) — todos os 7 critérios de aceite agora satisfeitos." },
    "review": { "status": "in_progress", "agent": "reviewer", "started_at": "2026-09-03T16:56:00-03:00", "finished_at": null, "notes": "Reverificação após remediação dos 3 findings major da primeira rodada de review." },
    "remediation": { "status": "done", "agent": "remediator", "started_at": "2026-09-03T16:36:00-03:00", "finished_at": "2026-09-03T16:55:00-03:00", "notes": "3 findings major resolvidos: (1) DJANGO_REDIS_LOG_IGNORED_EXCEPTIONS=True adicionado, validado com Redis genuinamente inacessível — log ERROR dispara; (2) importarPreferenciasDoBackendSeNecessario agora chamada em auth-context.tsx (login + restauração de sessão); (3) 9 testes novos em identidade/tests/test_preferencias_cookies.py. pytest identidade 54 passed, suíte completa 255 passed, tsc/next build limpos." },
    "documentation": { "status": "pending", "agent": "documenter", "started_at": null, "finished_at": null, "notes": "" },
    "closing": { "status": "pending", "agent": "historian", "started_at": null, "finished_at": null, "notes": "" }
  },
  "findings": { "blocker": 0, "major": 3, "minor": 0, "nit": 0, "resolved": 0 },
  "artifacts": {
    "task_plan": "task-plan.md",
    "implementation_contract": "implementation-contract.md",
    "implementation_history": "implementation-history.md",
    "code_review_contract": "code-review-contract.md"
  },
  "blocked_reason": null,
  "follow_ups": [
    "Run 2: CMS/painel administrativo e fluxo editorial",
    "Run 3: enriquecimento de artigo + navegação/homepage/busca",
    "Run 4: personalização + engajamento (salvar, seguir, notificações, newsletter)",
    "Run 5: multimídia",
    "Run 6: pipeline de IA/radar (crawlers, workers, resumo por IA, curadoria)",
    "Run 7: analytics/observabilidade",
    "Run 8: monetização/b2b",
    "Run 9: itens avançados (embeddings/busca vetorial/RAG/knowledge graph, TTS, lives, A/B testing, feature flags)"
  ],
  "created_at": "2026-09-03T11:34:00-03:00",
  "updated_at": "2026-09-03T11:34:00-03:00"
}
