{
  "run_id": "20260902-1521-painel-metricas-negocio",
  "task_title": "Painel de Métricas de Negócio",
  "status": "closed",
  "current_phase": "done",
  "iteration_count": 0,
  "max_iterations": 3,
  "requested_by": "usuário (buttielle3@gmail.com)",
  "source_spec": "agentic-framework/specs/painel-metricas-negocio.md",
  "phases": {
    "planning": { "status": "done", "agent": "orchestrator", "started_at": "2026-09-02T15:21:00-03:00", "finished_at": "2026-09-02T15:23:00-03:00", "notes": "" },
    "implementation": { "status": "done", "agent": "orchestrator (agindo como executor)", "execution_mode": "self_executed_fallback", "started_at": "2026-09-02T15:23:00-03:00", "finished_at": "2026-09-02T15:23:00-03:00", "notes": "3/3 critérios implementados." },
    "testing": { "status": "done", "agent": "orchestrator (via run-20260903-1350-validacao-real-suite-completa e run-20260903-1600-validacao-navegador)", "execution_mode": "delegated", "started_at": "2026-09-03T13:50:00-03:00", "finished_at": "2026-09-03T16:00:00-03:00", "notes": "Backend coberto pela suíte completa (190 passed). Frontend (/admin/metricas) confirmado por clique real no navegador na run de validação de navegador; bug real encontrado e corrigido nessa passada (badge de plano mostrando 'Free' para papel=admin em Header.tsx)." },
    "review": { "status": "skipped", "agent": "orchestrator", "started_at": null, "finished_at": null, "notes": "Agregação read-only via ORM, sem gatilho de review-triggers.md (não é auth/pagamento/PII/schema arriscado)." },
    "remediation": { "status": "skipped", "agent": "orchestrator", "started_at": null, "finished_at": null, "notes": "Nenhum finding próprio desta run — o bug de badge encontrado na validação de navegador foi corrigido na própria run de validação, não aqui." },
    "documentation": { "status": "done", "agent": "documenter", "execution_mode": "delegated", "started_at": "2026-09-03T00:00:00-03:00", "finished_at": "2026-09-03T00:00:00-03:00", "notes": "Endpoint /api/metricas/painel/ e rota /admin/metricas documentados em README.md." },
    "closing": { "status": "done", "agent": "orchestrator (reconciliação retroativa)", "started_at": "2026-09-03T00:00:00-03:00", "finished_at": "2026-09-03T00:00:00-03:00", "notes": "Fechamento tardio, reconciliado nesta passada." }
  },
  "findings": { "blocker": 0, "major": 0, "minor": 0, "nit": 0, "resolved": 0 },
  "artifacts": {
    "task_plan": "task-plan.md",
    "implementation_history": "implementation-history.md",
    "report": "report.md"
  },
  "blocked_reason": null,
  "follow_ups": [
    "CAC (custo de aquisição) explicitamente fora de escopo — não há dado de canal/marketing no sistema."
  ],
  "created_at": "2026-09-02T15:21:00-03:00",
  "updated_at": "2026-09-04T00:00:00-03:00"
}
