{
  "run_id": "20260902-1409-feed-consumo",
  "task_title": "Feed e Consumo de Notícias",
  "status": "closed",
  "current_phase": "done",
  "iteration_count": 0,
  "max_iterations": 3,
  "requested_by": "usuário (buttielle3@gmail.com)",
  "source_spec": "agentic-framework/specs/feed-consumo-noticias.md",
  "phases": {
    "planning": { "status": "done", "agent": "orchestrator", "started_at": "2026-09-02T14:09:00-03:00", "finished_at": "2026-09-02T14:20:00-03:00", "notes": "task-plan.md e implementation-contract.md produzidos." },
    "implementation": { "status": "done", "agent": "orchestrator (agindo como executor — Agent/Bash indisponíveis)", "execution_mode": "self_executed_fallback", "started_at": "2026-09-02T14:20:00-03:00", "finished_at": "2026-09-02T14:20:00-03:00", "notes": "8/8 critérios implementados via Edit direto (app feed/, sem modelo próprio, só leitura). 10 testes de sanidade escritos." },
    "testing": { "status": "done", "agent": "orchestrator (via run-20260903-1350-validacao-real-suite-completa)", "execution_mode": "delegated", "started_at": "2026-09-03T13:50:00-03:00", "finished_at": "2026-09-03T15:20:00-03:00", "notes": "pytest completo do projeto: 190 passed, 0 failed, incluindo os 10 testes de sanidade deste app. Resolve o bloqueio original (nenhuma execução tinha rodado até então)." },
    "review": { "status": "skipped", "agent": "orchestrator", "started_at": null, "finished_at": null, "notes": "Feed de leitura pública, sem gatilho de review-triggers.md." },
    "remediation": { "status": "skipped", "agent": "orchestrator", "started_at": null, "finished_at": null, "notes": "Nenhum finding a remediar." },
    "documentation": { "status": "done", "agent": "documenter", "execution_mode": "delegated", "started_at": "2026-09-01T00:00:00-03:00", "finished_at": "2026-09-01T00:00:00-03:00", "notes": "Endpoints de feed já documentados em README.md (seção de identidade/feed) e rota / documentada em 'Páginas disponíveis'." },
    "closing": { "status": "done", "agent": "orchestrator (reconciliação retroativa)", "started_at": "2026-09-03T00:00:00-03:00", "finished_at": "2026-09-03T00:00:00-03:00", "notes": "Fechamento tardio, reconciliado nesta passada. Dependência com run-20260902-0727-ingestao-noticias permanece: aquela run segue blocked por um critério de aceite real (AC-4, direitos autorais) que não afeta a validade desta run em si (feed apenas lê NewsItem/NewsCluster já existentes)." }
  },
  "findings": { "blocker": 0, "major": 0, "minor": 0, "nit": 0, "resolved": 0 },
  "artifacts": {
    "task_plan": "task-plan.md",
    "implementation_contract": "implementation-contract.md",
    "implementation_history": "implementation-history.md",
    "report": "report.md"
  },
  "blocked_reason": null,
  "follow_ups": [],
  "created_at": "2026-09-02T14:09:00-03:00",
  "updated_at": "2026-09-04T00:00:00-03:00"
}
